{
  "$schema": "../../schema/dictionary.schema.json",
  "title": "Product Launch Dictionary",
  "eyebrow": "Configurable term graph",
  "sidebarEyebrow": "Dictionary config",
  "description": "A synthetic public sample showing how teams can map a product launch vocabulary into terms, references, aliases, and typed relationships.",
  "instructions": "Edit the selected term, save the JSON config, or export a static view-only snapshot.",
  "searchPlaceholder": "Try GTM, launch, segment, KPI...",
  "defaultTermId": "product-launch",
  "categories": [
    {
      "id": "concept",
      "label": "Concept",
      "color": "--cp-border-strong"
    },
    {
      "id": "process",
      "label": "Process",
      "color": "--cp-warning"
    },
    {
      "id": "role",
      "label": "Role",
      "color": "--cp-success"
    },
    {
      "id": "artifact",
      "label": "Artifact",
      "color": "--cp-link"
    },
    {
      "id": "metric",
      "label": "Metric",
      "color": "--cp-warning"
    },
    {
      "id": "channel",
      "label": "Channel",
      "color": "--cp-text-muted"
    },
    {
      "id": "asset",
      "label": "Asset",
      "color": "--cp-link"
    },
    {
      "id": "stage",
      "label": "Stage",
      "color": "--cp-border-strong"
    },
    {
      "id": "insight",
      "label": "Insight",
      "color": "--cp-success"
    },
    {
      "id": "risk",
      "label": "Risk",
      "color": "--cp-danger"
    },
    {
      "id": "experiment",
      "label": "Experiment",
      "color": "--cp-warning"
    },
    {
      "id": "operation",
      "label": "Operation",
      "color": "--cp-text-muted"
    }
  ],
  "sources": [
    {
      "id": "launch-workshop",
      "title": "Launch planning workshop",
      "type": "Workshop notes",
      "url": "",
      "notes": "Synthetic source for launch goals, roles, stages, and assumptions."
    },
    {
      "id": "customer-research-summary",
      "title": "Customer research summary",
      "type": "Research notes",
      "url": "",
      "notes": "Synthetic source for customer segments, needs, objections, and positioning."
    },
    {
      "id": "launch-scorecard",
      "title": "Launch scorecard",
      "type": "Measurement plan",
      "url": "",
      "notes": "Synthetic source for KPIs, targets, adoption, conversion, and retention."
    }
  ],
  "terms": [
    {
      "id": "product-launch",
      "title": "Product Launch",
      "category": "process",
      "summary": "Coordinated release of a product or feature to a target audience.",
      "details": "A launch connects planning, readiness, messaging, channel activation, measurement, and follow-up into one lifecycle.",
      "aliases": [
        "Launch",
        "Release"
      ],
      "related": [
        "launch-plan",
        "go-to-market-strategy",
        "launch-readiness-review",
        "success-metric"
      ],
      "sourceIds": [
        "launch-workshop",
        "launch-scorecard"
      ]
    },
    {
      "id": "go-to-market-strategy",
      "title": "Go-To-Market Strategy",
      "category": "artifact",
      "summary": "Plan for reaching the right audience with the right message and channel mix.",
      "details": "The GTM strategy defines the target segment, positioning, launch channels, success metrics, and feedback loops.",
      "aliases": [
        "GTM",
        "GTM Strategy"
      ],
      "related": [
        "product-launch",
        "customer-segment",
        "positioning-statement",
        "launch-channel"
      ],
      "sourceIds": [
        "launch-workshop",
        "customer-research-summary"
      ]
    },
    {
      "id": "launch-plan",
      "title": "Launch Plan",
      "category": "artifact",
      "summary": "Documented plan for launch activities, owners, dates, dependencies, and risks.",
      "details": "The plan gives teams a shared operating view across launch readiness, campaigns, enablement, support, and measurement.",
      "aliases": [
        "Plan"
      ],
      "related": [
        "product-launch",
        "launch-owner",
        "launch-milestone",
        "launch-risk"
      ],
      "sourceIds": [
        "launch-workshop"
      ]
    },
    {
      "id": "launch-owner",
      "title": "Launch Owner",
      "category": "role",
      "summary": "Person accountable for coordinating launch execution and tradeoff decisions.",
      "details": "The launch owner keeps work moving across product, marketing, sales, support, and analytics.",
      "aliases": [
        "Owner"
      ],
      "related": [
        "launch-plan",
        "product-manager",
        "readiness-owner"
      ],
      "sourceIds": [
        "launch-workshop"
      ]
    },
    {
      "id": "product-manager",
      "title": "Product Manager",
      "category": "role",
      "summary": "Person accountable for product direction, scope, and customer value.",
      "details": "The product manager connects customer needs, business goals, launch scope, and roadmap decisions.",
      "aliases": [
        "PM"
      ],
      "related": [
        "product-launch",
        "roadmap",
        "customer-segment",
        "positioning-statement"
      ],
      "sourceIds": [
        "launch-workshop",
        "customer-research-summary"
      ]
    },
    {
      "id": "customer-segment",
      "title": "Customer Segment",
      "category": "concept",
      "summary": "Group of customers with shared needs, behaviors, or buying triggers.",
      "details": "Segments help teams tailor messaging, prioritization, onboarding, and success metrics.",
      "aliases": [
        "Segment",
        "Audience"
      ],
      "related": [
        "go-to-market-strategy",
        "target-persona",
        "adoption-funnel"
      ],
      "sourceIds": [
        "customer-research-summary"
      ]
    },
    {
      "id": "target-persona",
      "title": "Target Persona",
      "category": "concept",
      "summary": "Representative user or buyer profile for launch planning.",
      "details": "A persona makes audience assumptions explicit so messaging and channel choices can be tested.",
      "aliases": [
        "Persona"
      ],
      "related": [
        "customer-segment",
        "positioning-statement",
        "customer-objection"
      ],
      "sourceIds": [
        "customer-research-summary"
      ]
    },
    {
      "id": "positioning-statement",
      "title": "Positioning Statement",
      "category": "artifact",
      "summary": "Concise explanation of who the product is for and why it matters.",
      "details": "Positioning turns customer research into a clear claim that can be used across channels.",
      "aliases": [
        "Positioning",
        "Message"
      ],
      "related": [
        "go-to-market-strategy",
        "target-persona",
        "launch-channel"
      ],
      "sourceIds": [
        "customer-research-summary"
      ]
    },
    {
      "id": "customer-objection",
      "title": "Customer Objection",
      "category": "concept",
      "summary": "Concern or blocker that may prevent adoption.",
      "details": "Objections inform messaging, enablement, support content, and readiness planning.",
      "aliases": [
        "Objection",
        "Concern"
      ],
      "related": [
        "target-persona",
        "sales-enablement",
        "support-readiness"
      ],
      "sourceIds": [
        "customer-research-summary"
      ]
    },
    {
      "id": "launch-channel",
      "title": "Launch Channel",
      "category": "channel",
      "summary": "Surface used to reach, educate, or activate the target audience.",
      "details": "Channels can include email, events, sales outreach, in-product messaging, partner motions, or community campaigns.",
      "aliases": [
        "Channel"
      ],
      "related": [
        "go-to-market-strategy",
        "email-campaign",
        "webinar",
        "partner-motion"
      ],
      "sourceIds": [
        "launch-workshop"
      ]
    },
    {
      "id": "email-campaign",
      "title": "Email Campaign",
      "category": "channel",
      "summary": "Outbound sequence used to announce, educate, or nurture customers.",
      "details": "Email is often paired with landing pages, webinars, and sales follow-up.",
      "aliases": [
        "Email"
      ],
      "related": [
        "launch-channel",
        "conversion-rate",
        "positioning-statement"
      ],
      "sourceIds": [
        "launch-workshop",
        "launch-scorecard"
      ]
    },
    {
      "id": "webinar",
      "title": "Webinar",
      "category": "channel",
      "summary": "Live or recorded session used to explain the launch and answer questions.",
      "details": "Webinars help teams validate interest, capture objections, and generate qualified follow-up.",
      "aliases": [
        "Event"
      ],
      "related": [
        "launch-channel",
        "qualified-lead",
        "customer-objection"
      ],
      "sourceIds": [
        "launch-workshop"
      ]
    },
    {
      "id": "partner-motion",
      "title": "Partner Motion",
      "category": "channel",
      "summary": "Launch path that reaches customers through partner sellers or ecosystems.",
      "details": "Partner motions need clear enablement, shared messaging, and handoff rules.",
      "aliases": [
        "Partner GTM"
      ],
      "related": [
        "launch-channel",
        "sales-enablement",
        "qualified-lead"
      ],
      "sourceIds": [
        "launch-workshop"
      ]
    },
    {
      "id": "launch-readiness-review",
      "title": "Launch Readiness Review",
      "category": "process",
      "summary": "Checkpoint that confirms launch requirements are met.",
      "details": "The review validates dependencies, risks, support coverage, channel readiness, and go/no-go criteria.",
      "aliases": [
        "Readiness Review",
        "Go/No-Go"
      ],
      "related": [
        "product-launch",